{
  "schema_version": "1.0",
  "id": "privileged-group-change",
  "title": "Synthetic privileged group change",
  "objective": "Detect an unexpected administrative group membership change and produce an evidence-preserving simulated response.",
  "authorization_boundary": "Synthetic audit records only. No identity provider or host is modified.",
  "expected_outcome": "One critical detection associated with the unauthorized group-change event.",
  "expectations": {
    "detection_count": 1,
    "rule_ids": ["IAM-PRIV-001"],
    "severity_counts": {"critical": 1},
    "simulated_action_count": 1
  },
  "rules": [
    {
      "id": "IAM-PRIV-001",
      "name": "Unexpected privileged group membership change",
      "severity": "critical",
      "description": "A non-approved actor adds an account to a privileged group.",
      "match": [
        {"field": "category", "operator": "eq", "value": "identity_change"},
        {"field": "action", "operator": "eq", "value": "add_to_privileged_group"},
        {"field": "outcome", "operator": "eq", "value": "success"},
        {"field": "tags", "operator": "contains", "value": "unauthorized"},
        {"field": "details.change_ticket", "operator": "exists", "value": false}
      ],
      "response": {
        "action": "recommend_account_review",
        "description": "Recommend reviewing the synthetic actor and target accounts, preserving the audit record, and confirming change authorization.",
        "mode": "simulated"
      }
    }
  ]
}
